{
  "record": "Enregister",
  "recording": "Enregistrement...",
  "selectSource": "Choisir la source",
  "settings": "Paramètres",
  "stop": "Arrêt",
  "time": {
    "hour": "herue",
    "hours": "herues",
    "minute": "minute",
    "minutes": "minutes",
    "second": "",
    "seconds": ""
  },
  "fileCount": {
    "one": "{{count}} fichier",
    "others": "{{count}} fichiers"
  }
}
